videoId,authorDisplayName,publishedAt,updatedAt,likeCount,totalReplyCount,textDisplay
rDxrpSqYHD8,@anjelomanoranjan3908,2023-11-02 20:54:09+00:00,2023-11-02 20:54:09+00:00,0,0,I want to see Lei Wulong in Tekken 8!!! I want to see Lei Wulong in Tekken 8!!! I want to see Lei Wulong in Tekken 8!!! I want to see Lei Wulong in Tekken 8!!! I want to see Lei Wulong in Tekken 8!!! I want to see Lei Wulong in Tekken 8!!! I want to see Lei Wulong in Tekken 8!!! I want to see Lei Wulong in Tekken 8!!! I want to see Lei Wulong in Tekken 8!!! I want to see Lei Wulong in Tekken 8!!! I want to see Lei Wulong in Tekken 8!!! I want to see Lei Wulong in Tekken 8!!! I want to see Lei Wulong in Tekken 8!!! I want to see Lei Wulong in Tekken 8!!! I want to see Lei Wulong in Tekken 8!!! I want to see Lei Wulong in Tekken 8!!! I want to see Lei Wulong in Tekken 8!!! I want to see Lei Wulong in Tekken 8!!! I want to see Lei Wulong in Tekken 8!!! I want to see Lei Wulong in Tekken 8!!! I want to see Lei Wulong in Tekken 8!!! I want to see Lei Wulong in Tekken 8!!! I want to see Lei Wulong in Tekken 8!!! I want to see Lei Wulong in Tekken 8!!! I want to see Lei Wulong in Tekken 8!!! I want to see Lei Wulong in Tekken 8!!! I want to see Lei Wulong in Tekken 8!!! I want to see Lei Wulong in Tekken 8!!! I want to see Lei Wulong in Tekken 8!!! I want to see Lei Wulong in Tekken 8!!! I want to see Lei Wulong in Tekken 8!!! I want to see Lei Wulong in Tekken 8!!! I want to see Lei Wulong in Tekken 8!!! I want to see Lei Wulong in Tekken 8!!! I want to see Lei Wulong in Tekken 8!!! I want to see Lei Wulong in Tekken 8!!! I want to see Lei Wulong in Tekken 8!!! I want to see Lei Wulong in Tekken 8!!! I want to see Lei Wulong in Tekken 8!!! I want to see Lei Wulong in Tekken 8!!! I want to see Lei Wulong in Tekken 8!!! I want to see Lei Wulong in Tekken 8!!! I want to see Lei Wulong in Tekken 8!!! I want to see Lei Wulong in Tekken 8!!! I want to see Lei Wulong in Tekken 8!!! I want to see Lei Wulong in Tekken 8!!! I want to see Lei Wulong in Tekken 8!!! I want to see Lei Wulong in Tekken 8!!! I want to see Lei Wulong in Tekken 8!!! I want to see Lei Wulong in Tekken 8!!! I want to see Lei Wulong in Tekken 8!!! I want to see Lei Wulong in Tekken 8!!! I want to see Lei Wulong in Tekken 8!!! I want to see Lei Wulong in Tekken 8!!! I want to see Lei Wulong in Tekken 8!!! I want to see Lei Wulong in Tekken 8!!! I want to see Lei Wulong in Tekken 8!!! I want to see Lei Wulong in Tekken 8!!! I want to see Lei Wulong in Tekken 8!!! I want to see Lei Wulong in Tekken 8!!! I want to see Lei Wulong in Tekken 8!!! I want to see Lei Wulong in Tekken 8!!! I want to see Lei Wulong in Tekken 8!!! I want to see Lei Wulong in Tekken 8!!! I want to see Lei Wulong in Tekken 8!!! I want to see Lei Wulong in Tekken 8!!! I want to see Lei Wulong in Tekken 8!!! I want to see Lei Wulong in Tekken 8!!! I want to see Lei Wulong in Tekken 8!!! I want to see Lei Wulong in Tekken 8!!! I want to see Lei Wulong in Tekken 8!!! I want to see Lei Wulong in Tekken 8!!! I want to see Lei Wulong in Tekken 8!!! I want to see Lei Wulong in Tekken 8!!! I want to see Lei Wulong in Tekken 8!!! I want to see Lei Wulong in Tekken 8!!! I want to see Lei Wulong in Tekken 8!!! I want to see Lei Wulong in Tekken 8!!! I want to see Lei Wulong in Tekken 8!!! I want to see Lei Wulong in Tekken 8!!! I want to see Lei Wulong in Tekken 8!!! I want to see Lei Wulong in Tekken 8!!! I want to see Lei Wulong in Tekken 8!!! I want to see Lei Wulong in Tekken 8!!! I want to see Lei Wulong in Tekken 8!!! I want to see Lei Wulong in Tekken 8!!! I want to see Lei Wulong in Tekken 8!!! I want to see Lei Wulong in Tekken 8!!! I want to see Lei Wulong in Tekken 8!!! I want to see Lei Wulong in Tekken 8!!! I want to see Lei Wulong in Tekken 8!!! I want to see Lei Wulong in Tekken 8!!! I want to see Lei Wulong in Tekken 8!!! I want to see Lei Wulong in Tekken 8!!! I want to see Lei Wulong in Tekken 8!!! I want to see Lei Wulong in Tekken 8!!! I want to see Lei Wulong in Tekken 8!!! I want to see Lei Wulong in Tekken 8!!! I want to see Lei Wulong in Tekken 8!!! I want to see Lei Wulong in Tekken 8!!! I want to see Lei Wulong in Tekken 8!!! I want to see Lei Wulong in Tekken 8!!! I want to see Lei Wulong in Tekken 8!!! I want to see Lei Wulong in Tekken 8!!! I want to see Lei Wulong in Tekken 8!!! I want to see Lei Wulong in Tekken 8!!! I want to see Lei Wulong in Tekken 8!!! I want to see Lei Wulong in Tekken 8!!! I want to see Lei Wulong in Tekken 8!!! I want to see Lei Wulong in Tekken 8!!! I want to see Lei Wulong in Tekken 8!!! I want to see Lei Wulong in Tekken 8!!! I want to see Lei Wulong in Tekken 8!!! I want to see Lei Wulong in Tekken 8!!! I want to see Lei Wulong in Tekken 8!!! I want to see Lei Wulong in Tekken 8!!! I want to see Lei Wulong in Tekken 8!!! I want to see Lei Wulong in Tekken 8!!! I want to see Lei Wulong in Tekken 8!!! I want to see Lei Wulong in Tekken 8!!!
rDxrpSqYHD8,@1789crazy,2023-11-02 21:06:53+00:00,2023-11-02 21:06:53+00:00,0,0,Gonna miss fak and katarina. My mains are gone😂😂 fk tekken
rDxrpSqYHD8,@Tinus020172,2023-11-02 21:07:00+00:00,2023-11-02 21:07:00+00:00,2,0,Still don’t understand why we need a Kuma and Panda slot. Waste of character slot imo.
rDxrpSqYHD8,@jacobusvi6705,2023-11-02 21:08:53+00:00,2023-11-02 21:08:53+00:00,0,0,bro where is AK
rDxrpSqYHD8,@oscarix5625,2023-11-02 21:11:45+00:00,2023-11-02 21:11:45+00:00,2,0,Donde coño esta Miguel
rDxrpSqYHD8,@cieltv6046,2023-11-02 21:30:00+00:00,2023-11-02 21:30:00+00:00,0,0,so Shaheen and Zafina ... and no AK ......................
rDxrpSqYHD8,@bevinjames3154,2023-11-02 21:35:29+00:00,2023-11-02 21:35:29+00:00,0,0,(does Chaolan pose) Excellent! 👍
rDxrpSqYHD8,@alexzanderking1556,2023-11-02 21:44:09+00:00,2023-11-02 21:44:09+00:00,0,0,so is devil jIn his own character?
rDxrpSqYHD8,@velatacu,2023-11-02 21:45:02+00:00,2023-11-02 21:45:02+00:00,0,0,thanks god dj is in the game
rDxrpSqYHD8,@TheBombayMasterTony,2023-11-02 21:48:00+00:00,2023-11-02 21:48:00+00:00,0,0,&quot;You must live with your sins. You will only find atonement through solitude.&quot; - Devil Jin
rDxrpSqYHD8,@user-fm3xr9yz3i,2023-11-02 21:59:59+00:00,2023-11-02 21:59:59+00:00,0,0,WHERE IS LEI WULONG?
rDxrpSqYHD8,@Sparda8888,2023-11-02 22:00:51+00:00,2023-11-02 22:00:51+00:00,0,0,Dragunov is Coming Back!
rDxrpSqYHD8,@maaan278,2023-11-02 22:20:11+00:00,2023-11-02 22:20:11+00:00,1,0,"I&#39;m waiting for Lidia Sobieska, she is the only OG character of the new ones that I loved."
rDxrpSqYHD8,@maiconvilanova7223,2023-11-02 22:34:09+00:00,2023-11-02 22:34:09+00:00,0,0,Alisaaa ❤
rDxrpSqYHD8,@dimitarapostolov9788,2023-11-02 22:39:45+00:00,2023-11-02 22:39:45+00:00,0,0,No Anna... 😢
rDxrpSqYHD8,@leanbacksfinest,2023-11-02 22:46:31+00:00,2023-11-02 22:46:31+00:00,0,0,please add katarina alves woulkd be the biggest dream!
rDxrpSqYHD8,@tyvonnemackey5112,2023-11-02 22:53:02+00:00,2023-11-02 22:53:02+00:00,0,0,I need heihachi!!! 😭😭
rDxrpSqYHD8,@cristianmele5009,2023-11-02 22:58:05+00:00,2023-11-02 22:58:05+00:00,0,0,Ancora quel marocchino 😑
rDxrpSqYHD8,@steffou4087,2023-11-02 23:05:11+00:00,2023-11-02 23:06:04+00:00,0,0,"Pleaaaaaaaassssse , bruce come back !!!!!"
rDxrpSqYHD8,@flamehashira8199,2023-11-02 23:10:45+00:00,2023-11-02 23:11:58+00:00,2,1,I wish Bandai would add Baki Hanma and Yujiro Hanma to the game. That would be 🔥🔥🔥!
rDxrpSqYHD8,@CheekSpread,2023-11-02 23:27:51+00:00,2023-11-02 23:27:51+00:00,1,0,"The title says return of legends... I don&#39;t see roger,Alex or Mokujin"
rDxrpSqYHD8,@brunomiguel9693,2023-11-02 23:28:12+00:00,2023-11-02 23:28:12+00:00,0,0,Where is <br>Lucky chloe and Eddy 😢😢😢
rDxrpSqYHD8,@Draconius1000,2023-11-02 23:34:18+00:00,2023-11-02 23:34:18+00:00,1,2,good roadster
rDxrpSqYHD8,@GohTakeshita,2023-11-02 23:59:45+00:00,2023-11-02 23:59:45+00:00,2,0,No Julia or Bruce/Josie archetype...😢
rDxrpSqYHD8,@rdot1447,2023-11-03 00:19:12+00:00,2023-11-03 00:19:12+00:00,0,0,no Eddy Gordo my main for 20+ years guess we on Bruce now
rDxrpSqYHD8,@Damon-ul4zy,2023-11-03 00:33:14+00:00,2023-11-03 00:33:14+00:00,0,0,"Lei Wulong, aaaaaah , <br>where are you🫣"
rDxrpSqYHD8,@PhoenixFeather09,2023-11-03 00:38:46+00:00,2023-11-03 00:38:46+00:00,14,0,I am glad to see Zafina. I love her fighting style
rDxrpSqYHD8,@slicksilver2961,2023-11-03 00:39:28+00:00,2023-11-03 00:39:28+00:00,206,6,"Not only am I hyped to see Lee back, and Yoshimitsu having a Tekken 3 like look to his newest drip, I’m so happy to see Devil Jin get some characterization through his drip AND from his voice actor Isshin Chiba. I’m really getting Sukuna from JJK vibes and I love it. I can’t wait for this game"
rDxrpSqYHD8,@juanikko97,2023-11-03 00:40:39+00:00,2023-11-03 00:40:39+00:00,0,0,A new version of MIGUEL please 🥲🙏🏼
rDxrpSqYHD8,@kingspiffy_6mg520,2023-11-03 00:46:24+00:00,2023-11-03 00:46:24+00:00,0,0,Hwoarang looks different Dude but it’s fire not to different 🔥Steve fox looks different 🔥I just love tekken ❤️‍🔥‼️🔥
rDxrpSqYHD8,@mengleong2837,2023-11-03 00:52:04+00:00,2023-11-03 00:52:04+00:00,0,0,"<a href=""https://www.youtube.com/watch?v=rDxrpSqYHD8&amp;t=44"">0:44</a>"
rDxrpSqYHD8,@Kazeshini6,2023-11-03 00:54:35+00:00,2023-11-03 00:54:35+00:00,0,0,Where tf is lei
rDxrpSqYHD8,@JhettProductions,2023-11-03 00:55:48+00:00,2023-11-03 00:55:48+00:00,0,0,"Okay, but where&#39;s Armor King"
rDxrpSqYHD8,@adipratama4335,2023-11-03 01:02:23+00:00,2023-11-03 01:02:23+00:00,0,0,Still waiting for Gon
rDxrpSqYHD8,@Aimai.37,2023-11-03 01:10:32+00:00,2023-11-03 01:10:32+00:00,1,0,"Random but imagine they have that open story mode like in Tekken 6, i kinda miss that ngl. But damn everything of this game looks amazing so far"
rDxrpSqYHD8,@tonydak8573,2023-11-03 01:17:24+00:00,2023-11-03 01:17:24+00:00,0,0,"Listen, Tekken fans. We are UP!"
rDxrpSqYHD8,@tonydak8573,2023-11-03 01:20:01+00:00,2023-11-03 01:20:31+00:00,0,0,Here me out…what if we get Sukuna as a special secret/DLC character?
rDxrpSqYHD8,@doomstothfilms,2023-11-03 01:20:27+00:00,2023-11-03 01:20:27+00:00,0,0,Alisa with high res armpits confirmed
rDxrpSqYHD8,@GrayFox4374,2023-11-03 01:23:44+00:00,2023-11-03 01:23:44+00:00,4,3,"I know they won&#39;t add any Guests Characters to the Tekken 8 now at the begining and they will come in the future. But boy, I hope they add Tifa Lockhart as Guest Character in Tekken 8 because she really fits in Tekken gameplay style also her kit gameplay is also fire 🔥"
rDxrpSqYHD8,@golden1648,2023-11-03 01:24:13+00:00,2023-11-03 01:24:13+00:00,2,0,I&#39;m so confused how are these 5 legends returning when they are all in the last damn game. Am I missing something
rDxrpSqYHD8,@deepakbatista980,2023-11-03 01:28:14+00:00,2023-11-03 01:28:14+00:00,0,0,ली lee Marduk
rDxrpSqYHD8,@AD-ll4iz,2023-11-03 01:31:00+00:00,2023-11-03 01:31:00+00:00,0,0,i bet its eddy
rDxrpSqYHD8,@Beiyuu,2023-11-03 01:48:43+00:00,2023-11-03 01:48:43+00:00,0,0,ALISAAAAAA
rDxrpSqYHD8,@inquisitor.chimkinsoopwitvegys,2023-11-03 01:49:22+00:00,2023-11-03 01:49:22+00:00,0,0,The only character i want to return is either lidia or ganryu and so far it seems like every character except for them is going to be in this game :/
rDxrpSqYHD8,@calesummers,2023-11-03 01:50:17+00:00,2023-11-03 01:50:17+00:00,0,0,Where’s anna??
rDxrpSqYHD8,@Dimas-ks4mw,2023-11-03 01:52:34+00:00,2023-11-03 01:52:50+00:00,1,0,kunimitsu please
rDxrpSqYHD8,@XHybridPirateX,2023-11-03 02:13:50+00:00,2023-11-03 02:13:50+00:00,0,0,"No Bob, no Buy! It&#39;s up to you Bandai Namco!"
rDxrpSqYHD8,@user-vd7tq5ge3h,2023-11-03 02:14:16+00:00,2023-11-03 02:14:16+00:00,2,0,I want Josie to be with them when it&#39;s released
rDxrpSqYHD8,@drjunpab4855,2023-11-03 02:15:51+00:00,2023-11-03 02:15:51+00:00,0,0,Come on Lucky Chloe!!
rDxrpSqYHD8,@chimakalu41,2023-11-03 02:19:38+00:00,2023-11-03 02:20:06+00:00,0,0,"<a href=""https://www.youtube.com/watch?v=rDxrpSqYHD8&amp;t=27"">0:27</a> yoshimitsu my main. Ok then👍🏾"
rDxrpSqYHD8,@SciModeler,2023-11-03 02:28:30+00:00,2023-11-03 02:30:21+00:00,1,0,"Now, we need Lei and Anna!!"
rDxrpSqYHD8,@thalisonreis500,2023-11-03 02:40:09+00:00,2023-11-03 02:40:09+00:00,0,0,Victor Chavalier &gt;
rDxrpSqYHD8,@cediegepiga5973,2023-11-03 02:44:19+00:00,2023-11-03 02:44:19+00:00,0,0,sad no filipino character :(
rDxrpSqYHD8,@brandonhill7594,2023-11-03 02:52:07+00:00,2023-11-03 02:52:07+00:00,0,0,I miss Eddy. 😑😞
rDxrpSqYHD8,@resewatson402,2023-11-03 03:00:05+00:00,2023-11-03 03:00:05+00:00,0,0,Y do they still disrespect lei like he not a legend wtf yo i dont understand why lei is not in the game is it bec of copyright or something lei is my favorite character on the game I&#39;m not rocking wit dis new tekken unless lei aka Jackie chan I&#39;n the game
rDxrpSqYHD8,@saje1988,2023-11-03 03:19:25+00:00,2023-11-03 03:19:25+00:00,0,0,It&#39;s looking like my wish for Bruce Irvin to return is between slim and none. 😢
rDxrpSqYHD8,@otaking3582,2023-11-03 03:20:54+00:00,2023-11-03 03:20:54+00:00,2,1,I thought Jin had just incorporated Devil Jin into his moveset. How the hell is he still a separate character?
rDxrpSqYHD8,@chainsta4e1,2023-11-03 03:33:15+00:00,2023-11-03 03:33:15+00:00,0,0,"That laugh, that &#39;Marvelous&#39;! It&#39;s Jarjit Singh!?"
rDxrpSqYHD8,@mrfavila520,2023-11-03 04:04:40+00:00,2023-11-03 04:04:40+00:00,0,0,Can&#39;t have Lee without Lei!!  Come on Lei Wu Long!!!
rDxrpSqYHD8,@supermodel8528,2023-11-03 04:10:24+00:00,2023-11-03 04:10:24+00:00,0,0,WHRRE MIGUEL AT BRUH
rDxrpSqYHD8,@Flexision,2023-11-03 04:10:57+00:00,2023-11-03 04:10:57+00:00,0,0,⛩️[Tekken Just Goes Hard For No Reason]🔗🔥
rDxrpSqYHD8,@adolfozobeldeayalaherrera,2023-11-03 04:15:07+00:00,2023-11-03 04:15:07+00:00,0,0,Devil Jin saves Jin.. Wtf 😍😍😍
rDxrpSqYHD8,@Cng215,2023-11-03 05:00:14+00:00,2023-11-03 05:00:14+00:00,1,0,Why do they always do this to Julia fans smh
rDxrpSqYHD8,@jaredm5303,2023-11-03 05:09:31+00:00,2023-11-03 05:09:31+00:00,0,0,No lucky chloe or dancer : (?????????
rDxrpSqYHD8,@jeffreyw4824,2023-11-03 05:11:37+00:00,2023-11-03 05:11:37+00:00,0,0,My zafina and Alisa is come back!!!
rDxrpSqYHD8,@AhahaiTzRicE,2023-11-03 05:27:43+00:00,2023-11-03 05:27:43+00:00,1,0,"why they do steve like that :,)"
rDxrpSqYHD8,@ogbigbossmon8932,2023-11-03 05:31:15+00:00,2023-11-03 05:31:15+00:00,0,0,No Li Wulong  or Eddy?. No Bruce? No Thanks
rDxrpSqYHD8,@00ednixon,2023-11-03 05:31:32+00:00,2023-11-03 05:31:32+00:00,0,0,I was waiting for marduk 😩
rDxrpSqYHD8,@VaZiiX9,2023-11-03 05:38:07+00:00,2023-11-03 05:38:07+00:00,0,0,Where the hell is eddy ??
rDxrpSqYHD8,@user-uf5rq3yq1j,2023-11-03 05:46:23+00:00,2023-11-03 05:46:23+00:00,1,0,시발 데빌진나오면 사야되잖아 시발
rDxrpSqYHD8,@silentgamer3086,2023-11-03 05:59:01+00:00,2023-11-03 05:59:01+00:00,1,0,Devil Jin move is just like Vegito sword attack 😁
rDxrpSqYHD8,@tanakotaro658,2023-11-03 06:17:43+00:00,2023-11-03 06:17:43+00:00,0,0,Yes Baby. Panda and Kuma. Baby
rDxrpSqYHD8,@JediArgento,2023-11-03 06:34:32+00:00,2023-11-03 06:34:32+00:00,0,0,"Please, I hope one of the next ones to be Anna Williams."
rDxrpSqYHD8,@gyudong406,2023-11-03 07:14:59+00:00,2023-11-03 07:14:59+00:00,0,0,plz armor king😭
rDxrpSqYHD8,@vittoriotripartito6391,2023-11-03 07:21:33+00:00,2023-11-03 07:21:33+00:00,0,0,Please Kunimitsu 🙏🏼🙏🏼
rDxrpSqYHD8,@pokemonadventuresanimewhen3023,2023-11-03 07:21:51+00:00,2023-11-03 07:21:51+00:00,2,0,"holllllyyyy, Devil Jin looks soooooooo goooooood"
rDxrpSqYHD8,@Blongster,2023-11-03 07:38:03+00:00,2023-11-03 07:38:03+00:00,0,0,Glad to see how Devil Jin should look like again when he debut in Tekken 5.
rDxrpSqYHD8,@feqol,2023-11-03 07:40:25+00:00,2023-11-03 07:40:25+00:00,1,0,LEE DRIP?? DEVIL JIN KI BLADE??? DAMN.
rDxrpSqYHD8,@SoulGhost5249,2023-11-03 07:45:17+00:00,2023-11-03 07:45:17+00:00,1,0,You forgot LEI Wulong  bandai😅😅
rDxrpSqYHD8,@nicholasc.3896,2023-11-03 07:48:22+00:00,2023-11-03 07:48:22+00:00,0,0,Give me Bayonetta idc wat anyone says otherwise
rDxrpSqYHD8,@nubesock5231,2023-11-03 08:02:56+00:00,2023-11-03 08:02:56+00:00,1,0,Bro just fuckin bring baek back already
rDxrpSqYHD8,@saifali-gy5jt,2023-11-03 08:14:27+00:00,2023-11-03 08:14:27+00:00,0,0,Is there any hope for Armor King?
rDxrpSqYHD8,@TSDFKOPM,2023-11-03 08:15:51+00:00,2023-11-03 08:15:51+00:00,1,0,No Miguel or Eddy...
rDxrpSqYHD8,@maxcounter9628,2023-11-03 08:26:51+00:00,2023-11-03 08:26:51+00:00,0,0,no more capoeira?
rDxrpSqYHD8,@christianbroussard3302,2023-11-03 08:31:37+00:00,2023-11-03 08:31:37+00:00,0,0,The damn bears and no christi please be so fr
rDxrpSqYHD8,@TSDFKOPM,2023-11-03 08:32:46+00:00,2023-11-03 08:32:46+00:00,1,0,Ergh why Zafina dawg
rDxrpSqYHD8,@ricardoperezcastillo2803,2023-11-03 08:37:21+00:00,2023-11-03 08:37:21+00:00,1,0,Yes Kiss Beautiful By Male Flexing Jin Figures Adult?! 😍😍😍😍😍😍😍😍🤤🤤🤤🤤🤤🤤😋😋😋😋😋😋💋🔝🔟🏳️‍🌈♂️👤💪🇯🇵
rDxrpSqYHD8,@DoubleOhBoob,2023-11-03 08:38:51+00:00,2023-11-03 08:38:51+00:00,2,0,I didn’t know Vegito was a demon 😂
rDxrpSqYHD8,@MechaG2,2023-11-03 08:45:02+00:00,2023-11-03 08:45:02+00:00,0,0,"I sure hope Kunimitsu II and Lidia Sobieska will return for this, too. 🤞"
rDxrpSqYHD8,@KHIKHIGOLO,2023-11-03 08:47:51+00:00,2023-11-03 08:47:51+00:00,0,0,Where is eddy gordo 😐😐😐😐😐😐😐😐😐😐😐😐😐😐😐😐😐😐😐😐😐😐😐😐😐😐😐😐😐😐And hihachi
rDxrpSqYHD8,@julesheart4784,2023-11-03 09:10:22+00:00,2023-11-03 09:10:22+00:00,0,0,Very excited for the game!! But also... still waiting for Julia 😭🤞🏻
rDxrpSqYHD8,@cemtokgoz,2023-11-03 09:17:15+00:00,2023-11-03 09:17:15+00:00,2,0,"Legend?I don&#39;t think so.<br><br>Real legends are Lei,BAEK,Heihachi and Eddy.<br><br>Up to now,character roaster incredibly disappointing.There are only 2 new characters.I think they will sell new characters as DLC content."
rDxrpSqYHD8,@hesoyamnine9956,2023-11-03 09:32:47+00:00,2023-11-03 09:32:47+00:00,0,1,no baki ? 😫
rDxrpSqYHD8,@mamatpelo7071,2023-11-03 10:04:23+00:00,2023-11-03 10:04:23+00:00,0,0,(victor announced in nov. 2nd)<br><br>me: last char in nov. 12th ? eddy gordo for sure (no eddy = no party) 😅
rDxrpSqYHD8,@Rio-zk2vv,2023-11-03 10:05:30+00:00,2023-11-03 10:05:30+00:00,1,0,"please, I hope you put Julia in tekken 8 too?! 😭🫶"
rDxrpSqYHD8,@wampaisen,2023-11-03 10:10:09+00:00,2023-11-03 10:10:09+00:00,0,0,BRING BACK CHLOE
rDxrpSqYHD8,@nadavzip,2023-11-03 10:12:26+00:00,2023-11-03 10:12:26+00:00,1,0,Where👏is👏Miguel??
rDxrpSqYHD8,@hollowficate,2023-11-03 10:29:45+00:00,2023-11-03 10:29:45+00:00,0,0,I thought Jin already have full control over his Devil gene.
rDxrpSqYHD8,@Padlock_Steve,2023-11-03 10:32:15+00:00,2023-11-03 10:32:15+00:00,0,0,Where is lucky Chloe
rDxrpSqYHD8,@blazin_sky,2023-11-03 10:34:14+00:00,2023-11-03 10:34:14+00:00,3,0,No one wanted Zafina back.
rDxrpSqYHD8,@PKitti-pc2ux,2023-11-03 10:36:29+00:00,2023-11-03 10:36:29+00:00,12,4,The roster keeps getting better and better. Would be nice to see a new and improved Fahkumram or Bruce to represent Muay Thai too.
rDxrpSqYHD8,@Nahan_Boker94,2023-11-03 10:48:55+00:00,2023-11-03 10:50:35+00:00,0,0,So Zafina is part of default rosters and Devil Jin still separate character!!!! Next? Eddie/Christie?! Fahkumram? Lidia Sobieska??
rDxrpSqYHD8,@EugeneA89,2023-11-03 11:05:11+00:00,2023-11-03 11:05:11+00:00,1,0,... return from Tekken 7? <br><br>F@ck U greedy corp. Don&#39;t buying this sh3t anymore.
rDxrpSqYHD8,@mr.d_d2130,2023-11-03 11:10:39+00:00,2023-11-03 11:10:39+00:00,0,0,💤💤💤💤💤💤💤💤💤💤💤💤💤💤💤💤💤💤💤💤💤💤💤💤💤NO IDEAS 👻👻👻💤💤NO IDEAS
rDxrpSqYHD8,@beer5250,2023-11-03 11:10:48+00:00,2023-11-03 11:10:48+00:00,0,0,Waiting for Kunimitsu
rDxrpSqYHD8,@GJBattles,2023-11-03 11:11:51+00:00,2023-11-03 11:11:51+00:00,0,0,I only recently learned that Jin shares a voice actor with Dio and now I can&#39;t unhear it.
rDxrpSqYHD8,@SlimShadyZA,2023-11-03 11:14:09+00:00,2023-11-03 11:14:09+00:00,0,2,Is Devil Jin a DLC?
rDxrpSqYHD8,@xcrszo,2023-11-03 11:40:41+00:00,2023-11-03 11:40:41+00:00,0,0,ALISA 😭
rDxrpSqYHD8,@Lusherknight,2023-11-03 11:49:49+00:00,2023-11-03 11:49:49+00:00,0,0,Glad we’re getting new and old characters!!! Hopefully DLC characters will be busted too
rDxrpSqYHD8,@TuDolla76,2023-11-03 11:51:05+00:00,2023-11-03 11:51:05+00:00,1,0,They need Bruce back in the biii***
rDxrpSqYHD8,@blood________bunny,2023-11-03 11:55:40+00:00,2023-11-03 11:55:40+00:00,0,0,i expected this
rDxrpSqYHD8,@Light_Vizible,2023-11-03 11:59:16+00:00,2023-11-03 11:59:16+00:00,1,2,So we got most of the characters from the last game. Why are they all not here from the start? All this trouble to give us the same game with less?
rDxrpSqYHD8,@dragunov815,2023-11-03 12:02:04+00:00,2023-11-03 12:02:04+00:00,0,0,Nice.
rDxrpSqYHD8,@amokkone,2023-11-03 12:11:00+00:00,2023-11-03 12:11:00+00:00,1,1,Where Lei Wulong?
rDxrpSqYHD8,@VassalRavenKills,2023-11-03 12:16:50+00:00,2023-11-03 12:16:50+00:00,0,0,Eddie Gordo not being strong... damn...
rDxrpSqYHD8,@kaibarrett,2023-11-03 12:25:54+00:00,2023-11-03 12:25:54+00:00,0,0,WHERE TF IS EDDY MANNNNNNNNNNNNNNNN
rDxrpSqYHD8,@danielbudiono7232,2023-11-03 12:27:17+00:00,2023-11-03 12:27:17+00:00,1,0,they could make a 3d tekken movie with these much hype
rDxrpSqYHD8,@julmiranda5244,2023-11-03 12:34:26+00:00,2023-11-03 12:34:26+00:00,0,0,BAKI PLSSSSSSSSS
rDxrpSqYHD8,@irfanmustafa8429,2023-11-03 12:36:49+00:00,2023-11-03 12:36:49+00:00,7,0,"Devil jin looks scary, strong and unstoppable. Let&#39;s see how he plays in the game. Until now he looks like a big deal to me."
rDxrpSqYHD8,@Tophifox,2023-11-03 12:55:55+00:00,2023-11-03 12:55:55+00:00,0,0,Lee chaolan my main OMG !!! I&#39;m waiting for tooooo long for the reveal !!! Thx soooo much !
rDxrpSqYHD8,@timbynum,2023-11-03 12:59:04+00:00,2023-11-03 12:59:04+00:00,0,0,How could you not at least attempt to main Lee
rDxrpSqYHD8,@halionextra,2023-11-03 12:59:48+00:00,2023-11-03 12:59:48+00:00,1,2,Why would you add Shaheen back tf
rDxrpSqYHD8,@Leonard_Washington76,2023-11-03 13:01:16+00:00,2023-11-03 13:01:16+00:00,0,0,Where’s Lei?!! He’s more of a legend than the four they showed!!
rDxrpSqYHD8,@Leonardovins.,2023-11-03 13:02:15+00:00,2023-11-03 13:02:15+00:00,3,0,"Devil jin with tekken 5 Designer, oh my god i about to cum!!"
rDxrpSqYHD8,@MrVideos2617,2023-11-03 13:20:11+00:00,2023-11-03 13:20:11+00:00,0,5,No akuma???? Why????
rDxrpSqYHD8,@twylight191,2023-11-03 13:21:58+00:00,2023-11-03 13:21:58+00:00,0,0,Y&#39;all really not putting Lei Wulong in this game?
rDxrpSqYHD8,@AbhishekSingh-lu8kt,2023-11-03 13:42:36+00:00,2023-11-03 13:42:36+00:00,0,0,"If Gon from Tekken 3 will be there, it will be awesome!!!!"
rDxrpSqYHD8,@GUXT1Nn,2023-11-03 13:49:08+00:00,2023-11-03 13:49:08+00:00,0,0,Onde está o Eddy?
rDxrpSqYHD8,@okaynickiii9565,2023-11-03 13:49:42+00:00,2023-11-03 13:49:42+00:00,0,0,Now all we need is Anna and julia
rDxrpSqYHD8,@samleuba112,2023-11-03 13:54:40+00:00,2023-11-03 13:54:40+00:00,0,0,Please Bandai team. Include Katarina in the base roster. I need my Mohawk girly in this game ❤❤❤
rDxrpSqYHD8,@ItsMehhhhssii,2023-11-03 13:59:43+00:00,2023-11-03 13:59:43+00:00,0,0,Smh where is my man bob
rDxrpSqYHD8,@whipofdarkness,2023-11-03 14:02:48+00:00,2023-11-03 14:02:48+00:00,0,0,It looks like Zafina is going to be extra fun this round. <br><br>Also let’s  make some noise My Anna Williams fans!  🌷🤍🌷🤍🌷🤍🌷🤍🌷🤍🌷🤍🌷🤍🌷🤍
rDxrpSqYHD8,@thebestcentaur,2023-11-03 14:13:44+00:00,2023-11-03 14:13:44+00:00,0,0,Would love to see Bruce return. Right now it looks like Muay Thai doesn&#39;t have a SINGLE representative in Tekken 8😢
rDxrpSqYHD8,@user-em9ip4zz9u,2023-11-03 14:21:07+00:00,2023-11-03 14:21:07+00:00,0,0,Cadê o revil de Steve Fox <br>?
rDxrpSqYHD8,@1evilskum1,2023-11-03 14:21:54+00:00,2023-11-03 14:21:54+00:00,0,0,So yoshimitsu ain&#39;t getting a trailer? Alright then.
rDxrpSqYHD8,@UltraLowSpecPC,2023-11-03 14:22:30+00:00,2023-11-03 14:22:30+00:00,0,0,로져를 돌려줘 태그2 부터 유기한건 너무 했잖아
rDxrpSqYHD8,@kennylallier,2023-11-03 14:43:40+00:00,2023-11-03 14:43:40+00:00,0,0,Légendes return? CAN we get heihachi please ?
rDxrpSqYHD8,@rayalmalki4099,2023-11-03 14:44:05+00:00,2023-11-03 14:44:05+00:00,0,0,Where’s hihachi!!!!!!!!!!!!!
rDxrpSqYHD8,@TrueDrew0327,2023-11-03 14:45:29+00:00,2023-11-03 14:45:29+00:00,0,0,I wish they would bring back Bruce Irving
rDxrpSqYHD8,@lakeithanorfleet2973,2023-11-03 14:50:00+00:00,2023-11-03 14:50:00+00:00,0,0,please add lei wulong 😩
rDxrpSqYHD8,@yesbutno3450,2023-11-03 15:02:28+00:00,2023-11-03 15:02:28+00:00,0,0,Damn that means no gameplay trailer for my boy Yoshi 😢
rDxrpSqYHD8,@privatepatan7833,2023-11-03 15:02:45+00:00,2023-11-03 15:02:45+00:00,0,0,Where the hell is anna williams
rDxrpSqYHD8,@YSNReview,2023-11-03 15:06:23+00:00,2023-11-03 15:06:23+00:00,1,0,No Kazumi!? No Josie!? No Kuni? are you shitting me.. damn it Harada.
rDxrpSqYHD8,@mostkasualplayer9640,2023-11-03 15:09:19+00:00,2023-11-03 15:09:19+00:00,0,0,🔥🔥🔥
rDxrpSqYHD8,@mostkasualplayer9640,2023-11-03 15:10:16+00:00,2023-11-03 15:10:16+00:00,0,0,Your fate is already decided
rDxrpSqYHD8,@Zyraphina,2023-11-03 15:15:29+00:00,2023-11-03 15:15:29+00:00,0,0,I knew it! there was a leak there someone write under Alisa&#39;s picture Josie... but it&#39;s my Main &lt;3 i hoped Alisa get a own trailer but looks like no.
rDxrpSqYHD8,@saibajinzero,2023-11-03 15:17:49+00:00,2023-11-03 15:17:49+00:00,0,0,Imma cry after seeing dj
rDxrpSqYHD8,@Daniel-Rain-YT,2023-11-03 15:20:55+00:00,2023-11-03 15:20:55+00:00,0,1,Awful 🤢🤮
rDxrpSqYHD8,@jacopo2948,2023-11-03 15:23:58+00:00,2023-11-03 15:23:58+00:00,0,0,where is my Heihachi???
