videoId,authorDisplayName,publishedAt,updatedAt,likeCount,totalReplyCount,textDisplay
rDxrpSqYHD8,@Charlie_Xmas,2023-11-02 03:58:13+00:00,2023-11-02 03:58:13+00:00,0,0,does this mean there&#39;s only 2 char left to show? one of my main is going to be DLC or axed :(
rDxrpSqYHD8,@Samaelx.,2023-11-02 03:59:48+00:00,2023-11-02 04:01:17+00:00,1,2,Seriously tho ? Having Jin and Devil Jin as two different characters is literally a wasted slot for any other character.
rDxrpSqYHD8,@speightsamuel5376,2023-11-02 04:02:00+00:00,2023-11-02 04:02:00+00:00,0,0,I thought theres gonna be a new trailer on Nov 2
rDxrpSqYHD8,@RedRayne-cf5cv,2023-11-02 04:05:23+00:00,2023-11-02 04:05:23+00:00,0,0,YES!!! my main devil jin is back
rDxrpSqYHD8,@iokuproductions7131,2023-11-02 04:06:11+00:00,2023-11-02 04:06:23+00:00,0,0,Get baki as a dlc and you get 2M units in one night.
rDxrpSqYHD8,@phiayang5952,2023-11-02 04:08:41+00:00,2023-11-02 04:08:41+00:00,0,1,where is Armor King and Marduk!!!
rDxrpSqYHD8,@yeahnah5639,2023-11-02 04:08:45+00:00,2023-11-02 04:08:45+00:00,0,0,"So ign gets access to this trailer and drops it, and that trailer says something coming 02/11. Then on 2/11, the reveal is, the same trailer?"
rDxrpSqYHD8,@NOTOUTGAMERSWORLD,2023-11-02 04:10:01+00:00,2023-11-02 04:10:01+00:00,0,0,Alisa ❤
rDxrpSqYHD8,@harrybeauberry3222,2023-11-02 04:10:18+00:00,2023-11-02 04:10:18+00:00,0,0,Ngl haradas an artist
rDxrpSqYHD8,@zackeryxaviernarain2126,2023-11-02 04:12:23+00:00,2023-11-02 04:12:23+00:00,0,0,"new trailer now , please !"
rDxrpSqYHD8,@allnighterist,2023-11-02 04:12:27+00:00,2023-11-02 04:12:27+00:00,0,0,Qudans please comeback!! We need DVJ players
rDxrpSqYHD8,@diegoandre8829,2023-11-02 04:13:28+00:00,2023-11-02 04:13:28+00:00,0,0,Baki and Yujiro
rDxrpSqYHD8,@meteorsmash9434,2023-11-02 04:14:56+00:00,2023-11-02 04:14:56+00:00,0,0,ALISA!!!!!!! ❤❤❤❤
rDxrpSqYHD8,@gerix20,2023-11-02 04:23:14+00:00,2023-11-02 04:23:14+00:00,0,0,"happy to see Lee Chaolan, but still the question remains - where is Lei? He needs to be in the starting roster"
rDxrpSqYHD8,@drieghan,2023-11-02 04:24:11+00:00,2023-11-02 04:24:11+00:00,0,0,"Lei Wulong es mas legenda que muchos de ahi y siempre lo dejan resagado , mal ahi bandai..."
rDxrpSqYHD8,@michaelmacaraeg7537,2023-11-02 04:26:03+00:00,2023-11-02 04:26:03+00:00,1,0,WHERE IS MY LEE&#39;S EXCELLLEEENTTTT
rDxrpSqYHD8,@ritikpandey7888,2023-11-02 04:27:12+00:00,2023-11-02 04:27:12+00:00,1,0,Jin thinks he&#39;s vegeto
rDxrpSqYHD8,@antoniobruce6126,2023-11-02 04:29:11+00:00,2023-11-02 04:29:11+00:00,0,0,I just need lei wulong then I’ll be happy
rDxrpSqYHD8,@501stfighter3,2023-11-02 04:36:48+00:00,2023-11-02 04:36:48+00:00,1,0,I’m still waiting for ridge racer
rDxrpSqYHD8,@InfamousMATRIX,2023-11-02 04:37:04+00:00,2023-11-02 04:37:04+00:00,2,0,I knew y’all couldn’t go without Devil Jin 😂
rDxrpSqYHD8,@levisoares8936,2023-11-02 04:39:17+00:00,2023-11-02 04:39:17+00:00,44,2,"Quero a Anna , Mokujin o Eddy e a Christie nesse jogo também"
rDxrpSqYHD8,@tavonnica,2023-11-02 04:40:18+00:00,2023-11-02 04:42:03+00:00,0,0,"Can we get Christie, Eddy, or Julia"
rDxrpSqYHD8,@francistein8409,2023-11-02 04:44:25+00:00,2023-11-02 04:44:25+00:00,1,0,the graphics looks off
rDxrpSqYHD8,@Telesmana,2023-11-02 04:45:08+00:00,2023-11-02 04:45:08+00:00,0,0,HOW CMON PUT BAKI OR YUJIRO HANMA
rDxrpSqYHD8,@daddyTHEFATHER330,2023-11-02 04:58:45+00:00,2023-11-02 04:58:45+00:00,0,0,Since when did Lee Chapman became a legend <br>Only devil jin and zafina counts as legends
rDxrpSqYHD8,@josephsmiley1,2023-11-02 04:59:12+00:00,2023-11-02 04:59:12+00:00,0,0,Devil Jin is just so...lame
rDxrpSqYHD8,@pyrune1,2023-11-02 05:03:26+00:00,2023-11-02 05:03:26+00:00,2,0,"Man, the bears get two character slots but my favorite Kangaroo gets none!?"
rDxrpSqYHD8,@KamenKami,2023-11-02 05:05:50+00:00,2023-11-02 05:05:50+00:00,0,0,Lee look like the hero form Rent A Hero.
rDxrpSqYHD8,@lalorondan1719,2023-11-02 05:10:20+00:00,2023-11-02 05:10:20+00:00,1,0,WHRE IS ANNAAAAA?????????????????!!!!!!!!!!!!!!!!
rDxrpSqYHD8,@DLMan84,2023-11-02 05:12:28+00:00,2023-11-02 05:26:02+00:00,1,0,"My girl Jun back, Nina looking good, now all thats missing is Julia and Lidia! Definitely getting this when it releases!"
rDxrpSqYHD8,@4rkothDS,2023-11-02 05:12:45+00:00,2023-11-02 05:12:45+00:00,1,0,Next ANNA pls ♥
rDxrpSqYHD8,@pedromarroquin9251,2023-11-02 05:13:37+00:00,2023-11-02 05:13:37+00:00,1,0,The Rage Art of Devil Jin looks very similar to the Spirit Sword of Vegetto.
rDxrpSqYHD8,@HoshiBeans,2023-11-02 05:14:03+00:00,2023-11-02 05:14:03+00:00,0,0,Love the roster! Where Kunimitsu at though?????
rDxrpSqYHD8,@paladingodtier,2023-11-02 05:14:13+00:00,2023-11-02 05:14:34+00:00,1,0,Alisa And Zafina Are legends? Lol Eddy And Bruce Irvin Are LEGENDS!
rDxrpSqYHD8,@GARDENER43,2023-11-02 05:17:18+00:00,2023-11-02 05:17:18+00:00,0,0,"Bear, panda,....,  koala next?"
rDxrpSqYHD8,@alexnostalgix,2023-11-02 05:21:52+00:00,2023-11-02 05:21:52+00:00,0,0,GIMME SONG NOW
rDxrpSqYHD8,@danix454,2023-11-02 05:27:20+00:00,2023-11-02 05:27:36+00:00,1,1,"I see only two… three legends. Devil Jin, Lee and Panda. Where tf is Gon or that old scientist dude? Unknown? Ogre? Those are legends."
rDxrpSqYHD8,@Bryle_,2023-11-02 05:27:21+00:00,2023-11-02 05:27:21+00:00,0,0,"The last two might be Eddie or Christie, capoeira has been there ever since."
rDxrpSqYHD8,@jokerlaffers12,2023-11-02 05:32:12+00:00,2023-11-02 05:32:12+00:00,1,1,"Other then the Brand new characterand Jun, this has been the exact same roster as Tekken 7 so far I wanted a bit more diversity"
rDxrpSqYHD8,@darksiders2002,2023-11-02 05:34:27+00:00,2023-11-02 05:34:27+00:00,0,0,"Now, should I wait a bit or to get the game asap? I mean, Zafina&#39;s back."
rDxrpSqYHD8,@clarentVtuber,2023-11-02 05:34:38+00:00,2023-11-02 05:34:38+00:00,1,0,devil jin laser sword spam here we go babyyyyyyyy
rDxrpSqYHD8,@yokaihollow589,2023-11-02 05:35:24+00:00,2023-11-02 05:35:24+00:00,0,0,"Yoshimitsu: Design looks better than ever.<br>Steve: Digging the new gear.<br>Dragovich: Kinds forgettable to me, but still.<br>Kuma: Wow, he looks like he&#39;s taking it seriously for once.<br>Leo: Red-orange suits him.<br>Shaheen: THANK GOD he&#39;s still here, his story with Kazuya needs to continue.<br>Panda: Meh.<br>Zafina: Looks way better than Nadj from KOF.<br>Leo: Tech outfit suits him<br>Alisa: Change her design all you want, she&#39;s still a badass.<br>Devil: <b>sigh</b> Sure, why not?"
rDxrpSqYHD8,@xyzen9673,2023-11-02 05:36:59+00:00,2023-11-02 05:36:59+00:00,0,1,2 guest characters maybe?
rDxrpSqYHD8,@JH-fw5xm,2023-11-02 05:37:26+00:00,2023-11-02 05:37:26+00:00,0,0,"I was not expecting my secondary ace fighter, Devil Jin, but that means I got to go back and train in tekken 7."
rDxrpSqYHD8,@edwinnoermansyah,2023-11-02 05:38:14+00:00,2023-11-02 05:38:14+00:00,0,0,WOW
rDxrpSqYHD8,@nintenx1235,2023-11-02 05:38:43+00:00,2023-11-02 05:38:43+00:00,0,0,I hope Eliza gets in. Love Tekken 7 but I&#39;m absolute garbage at anyone else. And she&#39;s funny.
rDxrpSqYHD8,@azumeow9607,2023-11-02 05:41:36+00:00,2023-11-02 05:41:36+00:00,0,0,I want Bruve Irvin :(
rDxrpSqYHD8,@closingstatement_,2023-11-02 05:46:16+00:00,2023-11-02 05:46:16+00:00,0,0,eddie gordo where😢
rDxrpSqYHD8,@carbodude5414,2023-11-02 05:47:18+00:00,2023-11-02 05:47:18+00:00,1,0,Devil Jin wearing a fancy suit now is pretty consistent with Tekken&#39;s theme about how its always a dude in a suit making the world a worst place to live in
rDxrpSqYHD8,@buhshmuh,2023-11-02 05:48:07+00:00,2023-11-02 05:48:07+00:00,1,0,Still buying this game even though you didnt pick me for any of the betas Nd the fact these are all returning characters.
rDxrpSqYHD8,@miggidymaze02,2023-11-02 05:52:08+00:00,2023-11-02 05:52:08+00:00,1,0,Where’s my Eliza? DLC at least plz plz plz ???
rDxrpSqYHD8,@miggidymaze02,2023-11-02 05:53:25+00:00,2023-11-02 05:53:25+00:00,1,0,Alisa Bosconovitch 🤞😍♥️
rDxrpSqYHD8,@Vienn1,2023-11-02 05:53:26+00:00,2023-11-02 05:53:26+00:00,4,0,KUNIMITSUUUUUUU PLEASEEEEEEEEEE
rDxrpSqYHD8,@Mohsinali-yi6wq,2023-11-02 05:54:34+00:00,2023-11-02 05:54:34+00:00,3,0,Every character is good.<br>But devil jin 👿 steal the show ❤️❤️❤️😘
rDxrpSqYHD8,@Mohsinali-yi6wq,2023-11-02 05:55:54+00:00,2023-11-02 05:55:54+00:00,1,0,Devil jin 😈 ❤❤❤
rDxrpSqYHD8,@tekkengodprime,2023-11-02 05:56:52+00:00,2023-11-02 05:56:52+00:00,1,0,Eliza DLC plz plz plz ??? ElizaTEKKEN8 🤞
rDxrpSqYHD8,@montelhelem8707,2023-11-02 05:58:18+00:00,2023-11-02 05:58:18+00:00,2,0,PLEASE let Lidia be base roster 😭🙏
rDxrpSqYHD8,@mirainikki6665,2023-11-02 06:04:05+00:00,2023-11-02 06:04:05+00:00,1,0,Lee&#39;s rage art is marvelous indeed
rDxrpSqYHD8,@ranins4649,2023-11-02 06:05:47+00:00,2023-11-02 06:05:47+00:00,0,0,Devil Jin is so menacing
rDxrpSqYHD8,@koisein9976,2023-11-02 06:06:02+00:00,2023-11-02 06:06:02+00:00,0,1,so far only leroy and azucena the new original character
rDxrpSqYHD8,@ranins4649,2023-11-02 06:06:16+00:00,2023-11-02 06:06:16+00:00,0,0,"<a href=""https://www.youtube.com/watch?v=rDxrpSqYHD8&amp;t=32"">0:32</a><br>Dragunov : what is that ?"
rDxrpSqYHD8,@ranins4649,2023-11-02 06:07:00+00:00,2023-11-02 06:07:00+00:00,0,0,"<a href=""https://www.youtube.com/watch?v=rDxrpSqYHD8&amp;t=43"">0:43</a><br>Panda beat Kuma"
rDxrpSqYHD8,@ItsKod,2023-11-02 06:09:16+00:00,2023-11-02 06:09:16+00:00,0,0,Dear god Let one of those last 2 slots be a Cameo Fighter!!
rDxrpSqYHD8,@ibendover4817,2023-11-02 06:11:48+00:00,2023-11-02 06:11:48+00:00,1,0,"No one asked for Shaheen, lol."
rDxrpSqYHD8,@TheKRRRX01,2023-11-02 06:14:26+00:00,2023-11-02 06:14:26+00:00,0,0,Why 2 devil jin the game?
rDxrpSqYHD8,@dluv4u2,2023-11-02 06:15:50+00:00,2023-11-02 06:15:50+00:00,0,0,The smokey lip though
rDxrpSqYHD8,@johnnyesmond9176,2023-11-02 06:27:31+00:00,2023-11-02 06:27:31+00:00,0,0,LEI WULONG PLEASE!!
rDxrpSqYHD8,@ArminasMisinas,2023-11-02 06:37:13+00:00,2023-11-02 06:37:13+00:00,0,0,I hope Miguel will be added.
rDxrpSqYHD8,@virtbird1391,2023-11-02 06:44:30+00:00,2023-11-02 06:44:30+00:00,0,0,BOB
rDxrpSqYHD8,@MichaelMagistrado,2023-11-02 06:53:13+00:00,2023-11-02 06:53:13+00:00,0,0,Hopefully they&#39;ll add Bruce or Josie. just want either since both have similar move sets.
rDxrpSqYHD8,@asterisk904,2023-11-02 06:56:39+00:00,2023-11-02 06:56:39+00:00,1,0,Finally!!!<br>my dear Alisa!!!
rDxrpSqYHD8,@irassassine,2023-11-02 06:59:05+00:00,2023-11-02 06:59:05+00:00,0,0,NEED EDDY!
rDxrpSqYHD8,@gauthamkalyan4784,2023-11-02 07:10:43+00:00,2023-11-02 07:10:43+00:00,0,0,I need you Armor
rDxrpSqYHD8,@TheDarkKnightRacist,2023-11-02 07:24:55+00:00,2023-11-02 07:24:55+00:00,0,0,still missing Heihachi and Marduk
rDxrpSqYHD8,@skzarc3532,2023-11-02 07:32:05+00:00,2023-11-02 07:32:05+00:00,1,0,goku black is that you?
rDxrpSqYHD8,@zeruszephuros5419,2023-11-02 07:45:59+00:00,2023-11-02 07:45:59+00:00,0,1,why no individual trailers anymore Dx
rDxrpSqYHD8,@mohammedBahashwan-mw7nh,2023-11-02 07:48:22+00:00,2023-11-02 07:48:22+00:00,0,0,no mokojin?
rDxrpSqYHD8,@PrinceLawless,2023-11-02 07:54:35+00:00,2023-11-02 07:54:35+00:00,0,0,I thought these characters were already there 😂
rDxrpSqYHD8,@theusualjavi,2023-11-02 08:06:05+00:00,2023-11-02 08:06:05+00:00,0,0,What about Anna Williams &amp; Josie Rizal?
rDxrpSqYHD8,@DarkerNemesis,2023-11-02 08:08:52+00:00,2023-11-02 08:08:52+00:00,0,0,Please make the last 2 Heihachi and Ogre. They are my mains since Tekken 3.
rDxrpSqYHD8,@XX6-JX9,2023-11-02 08:09:42+00:00,2023-11-02 08:13:05+00:00,0,0,Aside from fighting they have wonderful taste in clothing while engaging in duel. does anyone agree? or am i just over thinking it?<br><br>Can anyone suggest to Harada-san to Add Evil Mr.Karate as a Guest Competitor because of the Tengu spirit insist upon to do so XD
rDxrpSqYHD8,@tekijiyuu,2023-11-02 08:10:14+00:00,2023-11-02 08:10:22+00:00,1,0,Zafina ♥💘
rDxrpSqYHD8,@UICIDE_RIXT,2023-11-02 08:10:15+00:00,2023-11-02 08:10:15+00:00,1,0,YEEESSIR DEVIL JIN IS BACK
rDxrpSqYHD8,@endless4g637,2023-11-02 08:20:55+00:00,2023-11-02 08:20:55+00:00,1,0,"The real question we&#39;ve been waiting for, IS LEO a female now or male or neither xd"
rDxrpSqYHD8,@I_love_Negan,2023-11-02 08:22:38+00:00,2023-11-02 08:22:38+00:00,0,0,PLS NEGAN HAVE TO BE BACK !!
rDxrpSqYHD8,@neotokyo2227,2023-11-02 08:23:29+00:00,2023-11-02 08:23:29+00:00,0,0,WHWRE IS MIGUEL!?
rDxrpSqYHD8,@ekosaputro3580,2023-11-02 08:23:57+00:00,2023-11-02 08:23:57+00:00,0,0,I thought new characters like azusena turned out to be old characters😢
rDxrpSqYHD8,@ekosaputro3580,2023-11-02 08:26:51+00:00,2023-11-02 08:26:51+00:00,0,0,"I&#39;m waiting for the two new guest characters and bob, alex, eddie, gigas and negan with new faces that are original tekken characters."
rDxrpSqYHD8,@egmusic1925,2023-11-02 08:27:54+00:00,2023-11-02 08:27:54+00:00,0,0,W DJ drip
rDxrpSqYHD8,@G0dsPerfectldiot,2023-11-02 08:28:48+00:00,2023-11-02 08:28:48+00:00,0,0,OKAY BUT WHERE IS ANNA?
rDxrpSqYHD8,@aurangzeb3403,2023-11-02 08:32:10+00:00,2023-11-02 08:35:20+00:00,0,0,"Anna williams, Heihachi Mishima, Eddy and Lei wulong plz"
rDxrpSqYHD8,@Androideath666,2023-11-02 08:33:10+00:00,2023-11-02 08:33:10+00:00,0,0,leo? really? is HORRIBLE!
rDxrpSqYHD8,@windgodscythe9922,2023-11-02 08:36:03+00:00,2023-11-02 08:36:03+00:00,0,2,I&#39;d love it better if DVJ didn&#39;t come back. I think it&#39;s fused Jin and DVJ is better for T8
rDxrpSqYHD8,@juanalbertozevallosramos,2023-11-02 08:39:30+00:00,2023-11-02 08:39:30+00:00,1,0,And lidia ? Pleaseee
rDxrpSqYHD8,@dezsoolah7202,2023-11-02 08:42:36+00:00,2023-11-02 08:45:26+00:00,0,0,Yeah! Alisa is back!
rDxrpSqYHD8,@gaborszabo7765,2023-11-02 08:53:45+00:00,2023-11-02 08:53:45+00:00,0,0,Shame ol shi all over again 🤷
rDxrpSqYHD8,@gaborszabo7765,2023-11-02 08:54:03+00:00,2023-11-02 08:54:03+00:00,0,0,N disco trao music 🤣😂
rDxrpSqYHD8,@ichikazeonsilt3608,2023-11-02 09:07:06+00:00,2023-11-02 09:11:23+00:00,0,1,"Jin vs devil Jin inner realm in a nutshell 🗿<br>Jin can only tap half of devil gene power while the entity himself gain full power.<br>Unlike kazuya that already kill the devil gene entity in his inner realm so gain 100% devil gene power, jin was not sadly 😂"
rDxrpSqYHD8,@mharrtj6350,2023-11-02 09:18:16+00:00,2023-11-02 09:18:16+00:00,0,2,Current main : Steve fox<br>Childhood main : Devil Jin
rDxrpSqYHD8,@valse6195,2023-11-02 09:18:21+00:00,2023-11-02 09:18:21+00:00,0,0,"Anybody know what time the new character is gonna be revealed? They said it&#39;s today, November 2, but there hasn&#39;t been anything."
rDxrpSqYHD8,@itz_fonso,2023-11-02 09:27:00+00:00,2023-11-02 09:27:00+00:00,1,0,Why&#39;s dragunov so hot
rDxrpSqYHD8,@kelliealanis9485,2023-11-02 09:27:00+00:00,2023-11-02 09:27:00+00:00,0,2,Do you think how many DLC will be? And how many characters will be in it?
rDxrpSqYHD8,@AimanCool440,2023-11-02 09:28:50+00:00,2023-11-02 09:29:01+00:00,0,1,I still waiting Craig Marduk will return in tekken 8...
rDxrpSqYHD8,@ChoiDoHyeon,2023-11-02 09:35:57+00:00,2023-11-02 09:35:57+00:00,0,0,그래서 리디아는?
rDxrpSqYHD8,@ivanalexeev6505,2023-11-02 09:38:35+00:00,2023-11-02 09:38:35+00:00,0,0,Back in the day I couldn&#39;t dream about Tekken being released for PC. Now it seems granted. Insane!
rDxrpSqYHD8,@namapalsu2364,2023-11-02 09:44:45+00:00,2023-11-02 09:44:45+00:00,0,0,Heihachi or else.
rDxrpSqYHD8,@jigsaw833,2023-11-02 09:47:33+00:00,2023-11-02 09:47:33+00:00,0,2,It is a god damne shame that there is no Christie oder Eddy 😡
rDxrpSqYHD8,@erronh2267,2023-11-02 09:50:28+00:00,2023-11-02 09:50:28+00:00,0,0,armor king
rDxrpSqYHD8,@kate804,2023-11-02 09:51:12+00:00,2023-11-02 09:51:12+00:00,0,0,EXCELLENT!
rDxrpSqYHD8,@jaywood8969,2023-11-02 10:02:54+00:00,2023-11-02 10:02:54+00:00,1,0,"We need new Bruce Irvin, Armor King, Craig Marduk and Lei Wulong to appear"
rDxrpSqYHD8,@danilhakim2363,2023-11-02 10:03:01+00:00,2023-11-02 10:03:01+00:00,0,0,looking foward to use shahin
rDxrpSqYHD8,@anujsehgal6711,2023-11-02 10:05:53+00:00,2023-11-02 10:05:53+00:00,1,0,Devil Jin &lt;3333333333333333333
rDxrpSqYHD8,@TheAnimeknight002,2023-11-02 10:07:32+00:00,2023-11-02 10:07:32+00:00,0,0,I think angel will also returning 🤔
rDxrpSqYHD8,@jaywood8969,2023-11-02 10:08:13+00:00,2023-11-02 10:08:13+00:00,3,1,"I&#39;m looking forward to seeing the trailers for Steve Fox, Dragunov, Yoshimitsu, Shaheen and Lee Chaolan"
rDxrpSqYHD8,@Zetriiz,2023-11-02 10:17:10+00:00,2023-11-02 10:17:10+00:00,0,2,I’m guessing last 2 characters are Devil Kazuya and Heihachi?
rDxrpSqYHD8,@leozzinesan5772,2023-11-02 10:17:51+00:00,2023-11-02 10:17:51+00:00,0,0,Zafina using azazel&#39;s powers made my jaw drop in nostalgia
rDxrpSqYHD8,@VEGITOOO,2023-11-02 10:17:52+00:00,2023-11-02 10:17:52+00:00,1,2,No Yushimitsu????
rDxrpSqYHD8,@madhavendrasingh8158,2023-11-02 10:23:01+00:00,2023-11-02 10:23:01+00:00,0,0,I bet we can&#39;t get a masterpiece like tekken ever
rDxrpSqYHD8,@mcpelozer,2023-11-02 10:23:03+00:00,2023-11-02 10:23:03+00:00,0,0,"Heihachi, Miguel, Marduk, Armor King, Julia, Ganryu, Lei Wulong, Anna Williams are missing.<br>Who will fill up those two next?"
rDxrpSqYHD8,@Adastra14,2023-11-02 10:27:24+00:00,2023-11-02 10:27:24+00:00,0,0,"I&#39;ve never, EVER, been this hyped for LEE :D :D !"
rDxrpSqYHD8,@logandunlap9156,2023-11-02 10:31:52+00:00,2023-11-02 10:31:52+00:00,0,0,dragunov looks like a crusty ass rotting corpse i love it
rDxrpSqYHD8,@grimrow,2023-11-02 10:34:56+00:00,2023-11-02 10:34:56+00:00,0,0,so no miguel?
rDxrpSqYHD8,@druuudruuu6804,2023-11-02 10:36:39+00:00,2023-11-02 10:36:39+00:00,0,0,did i mias the yoshi trailer ?
rDxrpSqYHD8,@JESSROCKEDChannel,2023-11-02 10:40:43+00:00,2023-11-02 10:40:43+00:00,2,0,"<a href=""https://www.youtube.com/watch?v=rDxrpSqYHD8&amp;t=30"">0:30</a> Steve Fox&#39; dialogue sounded so cringe as hell. It&#39;s like he caught a pokemon or somethin"
rDxrpSqYHD8,@wolfmanjack9959,2023-11-02 10:43:16+00:00,2023-11-02 10:43:16+00:00,0,0,Oh god Steve what have they done to you 😢. Look how they massacred my boy.
rDxrpSqYHD8,@ciaranplunkett1395,2023-11-02 10:46:24+00:00,2023-11-02 10:46:24+00:00,0,2,Y&#39;all worked on this for years and only have 1 (ONE) new character? 😂😂
rDxrpSqYHD8,@user-ov2us9yx3z,2023-11-02 10:47:34+00:00,2023-11-02 10:47:34+00:00,1,0,데빌진 나온다!!!!!
rDxrpSqYHD8,@mojonijowjow,2023-11-02 10:51:39+00:00,2023-11-02 10:51:39+00:00,0,0,...Lei Wulong? 🤔🤔🤔
rDxrpSqYHD8,@prosp3ct2,2023-11-02 10:54:38+00:00,2023-11-02 10:54:38+00:00,0,1,so they are trying to say all these old characters are &quot;new&quot;
rDxrpSqYHD8,@biddybatnana5029,2023-11-02 10:57:04+00:00,2023-11-02 10:57:04+00:00,0,0,Dragunov ♥
rDxrpSqYHD8,@ChonkL0rd,2023-11-02 10:57:04+00:00,2023-11-02 10:57:04+00:00,0,0,"Come on where&#39;s the reveal?I know the remaining characters are Reina and Victor and you better release 3-4 character gameplay trailers along with it cause I AM NOT cool with what you&#39;re doing with the past trailers where you just show us a glimpse of every character that made it to T8 and then nothing.I want to see how they actually play not how they look,I can always change their appearance anytime in customization if I don&#39;t like it come on."
rDxrpSqYHD8,@geedigital,2023-11-02 11:02:13+00:00,2023-11-02 11:02:13+00:00,1,0,Nothing quite like the feeling of a new Tekken coming soon! These trailers are bangers!
rDxrpSqYHD8,@Microphonunlock,2023-11-02 11:02:57+00:00,2023-11-02 11:02:57+00:00,1,0,"Once again, the leak was real 😭😭😭"
rDxrpSqYHD8,@kungfumaster298,2023-11-02 11:04:51+00:00,2023-11-02 11:04:51+00:00,0,0,"Lei please! Oh, and the non-streamer Julia Chang version😂"
rDxrpSqYHD8,@mariopereztorres8151,2023-11-02 11:08:55+00:00,2023-11-02 11:09:28+00:00,1,0,Yes l Kiss Beautiful By This My Jin Figure and Toy in Ok List Japanese inglés! Thanks! 😍😍😍😍😍😍😍😍😍😘💋💯🎎🇯🇵
rDxrpSqYHD8,@ShabiPlays,2023-11-02 11:09:05+00:00,2023-11-02 11:09:05+00:00,2,0,I cannot describe how happy I&#39;m seeing devil jin in roster🥳💗
rDxrpSqYHD8,@user-tw4cq9pg4b,2023-11-02 11:21:06+00:00,2023-11-02 11:21:06+00:00,0,0,where Heihachi Mishima....
rDxrpSqYHD8,@barrydolo3000,2023-11-02 11:21:53+00:00,2023-11-02 11:21:53+00:00,0,0,Where TF is Lei Wulong 🫤
rDxrpSqYHD8,@dianfairos1206,2023-11-02 11:24:11+00:00,2023-11-02 11:24:11+00:00,0,0,"Where is Lei Wulong, Iron King, Marduk, Master Raven, Josie, Bruce, Wang, Christie, Eddy, Eliza, Kunimitsu, Negan, Geese, Akuma, Fahkumram, Noctis, Katarina etc..."
rDxrpSqYHD8,@IsJordanCool,2023-11-02 11:27:26+00:00,2023-11-02 11:27:26+00:00,0,0,Wheres Lucky Chloe. Looks like im gonna loose my main
rDxrpSqYHD8,@ok-yv7ho,2023-11-02 11:30:43+00:00,2023-11-02 11:30:43+00:00,0,0,Devil jin got inspiration from vegito for his rage art
rDxrpSqYHD8,@goldwarrior2497,2023-11-02 11:34:17+00:00,2023-11-02 11:34:17+00:00,0,0,Where&#39;s Eliza?
rDxrpSqYHD8,@goldwarrior2497,2023-11-02 11:34:43+00:00,2023-11-02 11:34:43+00:00,1,0,We need Her Back on Tekken 8. 😊
rDxrpSqYHD8,@Eyenem,2023-11-02 11:40:09+00:00,2023-11-02 11:40:09+00:00,1,0,Zafina ❤❤❤
rDxrpSqYHD8,@neodanni,2023-11-02 11:40:37+00:00,2023-11-02 11:40:37+00:00,0,0,Bro bring back NEGAN wtf
rDxrpSqYHD8,@WetBellend,2023-11-02 11:41:24+00:00,2023-11-02 11:41:24+00:00,0,0,Kuma in heihachi outfit?
rDxrpSqYHD8,@SamDynom8,2023-11-02 11:44:47+00:00,2023-11-02 11:44:47+00:00,3,0,"I’m really really hoping Mokujin will be in this game!!<br>Even if he’s DLC, I’ll buy him immediately"
rDxrpSqYHD8,@YOKIMY2000,2023-11-02 11:48:44+00:00,2023-11-02 11:48:44+00:00,0,0,Bring tekken cross street fighter back!!!!
rDxrpSqYHD8,@halo3boy1,2023-11-02 11:48:55+00:00,2023-11-02 11:48:55+00:00,1,0,Why does Zafina speak English and everyone else speak their native languages?
rDxrpSqYHD8,@iko111,2023-11-02 11:49:06+00:00,2023-11-02 11:49:06+00:00,1,0,Leeeee 💙💙💙
rDxrpSqYHD8,@midoriaoi1788,2023-11-02 11:51:18+00:00,2023-11-02 11:51:18+00:00,0,0,Finally Alisa 💜
rDxrpSqYHD8,@weerakitjitsereepong4285,2023-11-02 11:52:51+00:00,2023-11-02 11:52:51+00:00,0,0,Anna Williams plz
rDxrpSqYHD8,@marquiswolf2766,2023-11-02 11:56:00+00:00,2023-11-02 11:56:00+00:00,0,0,"This is nice hope kazumi,lucky,Josie and lei wulong be in the game also hope they add some Baki characters in as guest characters."
rDxrpSqYHD8,@FiftyMeth,2023-11-02 11:59:03+00:00,2023-11-02 11:59:03+00:00,1,0,"DEVIL JIN, YES YES!"
rDxrpSqYHD8,@Miltiades178,2023-11-02 12:04:34+00:00,2023-11-02 12:04:34+00:00,1,0,Bob
rDxrpSqYHD8,@jmytv3077,2023-11-02 12:09:35+00:00,2023-11-02 12:09:35+00:00,1,0,"I was thinking shockingly that why does Lee&#39;s armor suit more look like a cyborg robot terminator or something, no offense"
rDxrpSqYHD8,@Arkaniiio,2023-11-02 12:10:52+00:00,2023-11-02 12:10:52+00:00,0,0,CHRISTIE MONTEIRO PLEASE.
rDxrpSqYHD8,@travisbrown3776,2023-11-02 12:26:05+00:00,2023-11-02 12:26:05+00:00,0,0,Awesome
rDxrpSqYHD8,@tomo-nx8ji,2023-11-02 12:28:24+00:00,2023-11-02 12:28:24+00:00,0,0,Wow so beatiful i need review character for this game release haha
rDxrpSqYHD8,@justincrawford9947,2023-11-02 12:43:37+00:00,2023-11-02 12:43:51+00:00,0,0,Who character coming Nov 2nd???
rDxrpSqYHD8,@luisor5121,2023-11-02 12:43:39+00:00,2023-11-02 12:43:39+00:00,0,0,yo superó que no se olviden de Akuma 🤔
rDxrpSqYHD8,@sillytubbie,2023-11-02 12:44:12+00:00,2023-11-02 12:44:12+00:00,0,0,I need Marduk!
rDxrpSqYHD8,@warmachine8239,2023-11-02 12:53:14+00:00,2023-11-02 12:53:14+00:00,0,0,👇Miguel Rojo
rDxrpSqYHD8,@unknowni2633,2023-11-02 12:58:05+00:00,2023-11-02 12:58:05+00:00,0,0,ROGER JR. PLEASE!! 😭
rDxrpSqYHD8,@firmanaikatsu-kiwarriors5233,2023-11-02 13:00:25+00:00,2023-11-02 13:00:25+00:00,1,0,Alisa Bosconovicht C8e a.k.a Chevrolet Corvette C8e 2024 [B-C8e]<br><br>Come back for Player in Tekken 8
rDxrpSqYHD8,@primovictoria2380,2023-11-02 13:11:09+00:00,2023-11-02 13:11:09+00:00,0,0,"2nd game running characters that should be in the game will be locked behind £££, is £70 not enough for you greedy pigs?"
rDxrpSqYHD8,@elmohighwind1268,2023-11-02 13:15:32+00:00,2023-11-02 13:15:32+00:00,0,0,Lei &amp; Eddy?
rDxrpSqYHD8,@lucomusicofficial,2023-11-02 13:17:55+00:00,2023-11-02 13:17:55+00:00,0,0,Josie is next.
rDxrpSqYHD8,@Hanashi_mma,2023-11-02 13:19:31+00:00,2023-11-02 13:19:31+00:00,0,0,Damm devil jin looks cold !! Also interesting how he dresses like kazuya
rDxrpSqYHD8,@lucasplaysroblox001,2023-11-02 13:23:25+00:00,2023-11-02 13:23:25+00:00,0,0,"And fat Eddy, who is nothing good, I&#39;m Brazilian and this character is perfect, he always wanted revenge on Kazuya and this looks like it&#39;s going to be the last game and he&#39;s not"
rDxrpSqYHD8,@dumply3069,2023-11-02 13:24:44+00:00,2023-11-02 13:24:44+00:00,1,0,Like I can see devil Jin and Jin is gonna be major fight in the story
